{
  "kicker": "2026 회계연도 예산 배분안",
  "title": "사업부문별 예산 배분 — 상위 일곱 항목 기준안",
  "style": "donut",
  "unit": "억원(누계)",
  "series": [
    {
      "label": "연구개발 — 차세대 소재 플랫폼 구축",
      "value": 620,
      "display": "620.0억"
    },
    {
      "label": "생산기술 — 라인 자동화 계측 증설",
      "value": 430,
      "display": "430.0억"
    },
    {
      "label": "품질보증 — 신뢰성 시험동 확충 사업",
      "value": 340,
      "display": "340.0억"
    },
    {
      "label": "정보시스템 — 사내 데이터 기반 구축",
      "value": 250,
      "display": "250.0억"
    },
    {
      "label": "인재개발 — 전문가 심의 역량 강화안",
      "value": 180,
      "display": "180.0억"
    },
    {
      "label": "지속가능 — 탄소저감 설비 교체 계획",
      "value": 110,
      "display": "110.0억"
    },
    {
      "label": "대외협력 — 산학 공동연구 지원 예산",
      "value": 70,
      "display": "70.00억"
    }
  ],
  "total": {
    "value": 2000,
    "label": "총 배분예산 합계"
  },
  "center": {
    "value": "2,000",
    "label": "총 배분예산 합계"
  },
  "footnote": {
    "text": "이사회 의결 기준 · 예비비를 제외한 확정 배분액"
  },
  "frame": {
    "brand": "WebDesignAgents",
    "idx": "07",
    "total": "12"
  }
}
